{
  "$schema": "./d2rloader-baselines.schema.json",
  "schemaVersion": 1,
  "generatedAt": "2026-09-26T20:42:42.306Z",
  "promotedBaselineId": "d2rloader-1.2.1-public",
  "policy": {
    "allowVersionBasedRuntimeGate": false,
    "promotionRequiresQualification": true,
    "keepHistory": true
  },
  "baselines": [
    {
      "id": "d2rloader-1.2.1-public",
      "version": "1.2.1",
      "channel": "public",
      "stage": "promoted",
      "observedAt": "2026-09-04",
      "promotedAt": "2026-09-04",
      "supersededAt": null,
      "source": {
        "kind": "official-release",
        "url": "https://d2rloader.net/",
        "verifiedAt": "2026-09-04",
        "evidence": [
          "Mission/ruffneckk-suite-next-release.md:7-33",
          "analysis-cache/d2rloader-1.2.1-release-audit/"
        ]
      },
      "artifacts": [
        {
          "name": "D2RLoader.exe",
          "size": 23581032,
          "sha256": "27A79CCD61360CC03E7C623D20A46546E5732B9997C41DC185B5EFC335B5C084",
          "fileVersion": "1.2.1-beta",
          "evidencePath": "analysis-cache/d2rloader-1.2.1-release-audit/D2RLoader.exe"
        },
        {
          "name": "D2RCore.dll",
          "size": 16903512,
          "sha256": "2130A98D0B879696116A7DDDE5C11AE8C91942B54B8276DB43E02074A715BBC8",
          "fileVersion": "1.2.1-beta",
          "evidencePath": "analysis-cache/d2rloader-1.2.1-release-audit/D2RCore.dll"
        },
        {
          "name": "d2rloader.mpq",
          "size": 10820639,
          "sha256": "47BDAFFD1B2633C341640B8B823F782625467433DFBE3C5827DFAD44C381F997",
          "fileVersion": null,
          "evidencePath": "analysis-cache/d2rloader-1.2.1-release-audit/d2rloader.mpq"
        }
      ],
      "sdk": {
        "selectionPolicy": "minimum-required-capability",
        "pins": [
          {
            "apiVersion": 3,
            "tag": "v3",
            "commit": "4933e2c42cb2592958cd0df3b6dc5003102252d1",
            "role": "existing-component-default",
            "repository": "https://github.com/D2RLoader/PluginSDK"
          },
          {
            "apiVersion": 4,
            "tag": "v4",
            "commit": "6eb8f8b6192868214706bd6d528c5294f2f551b7",
            "role": "capability-opt-in",
            "repository": "https://github.com/D2RLoader/PluginSDK"
          }
        ]
      },
      "contracts": {
        "reviewed": true,
        "pluginManifestVersion": 2,
        "requiredExports": [
          "D2RLoaderGetPluginInfo",
          "D2RLoaderLoadPlugin",
          "D2RLoaderUnloadPlugin"
        ],
        "runtimeSelectionPolicy": "native-fingerprint-only"
      },
      "impactReview": [
        {
          "component": "ISC12",
          "disposition": "adapted",
          "evidence": "The public D2RCore provider set and compiler capture capacity were added and qualified in Mission/ruffneckk-suite-next-release.md:164-183."
        },
        {
          "component": "Vendor Stock Refresh",
          "disposition": "adapted",
          "evidence": "The public SendClientGameplayPacket provider was fingerprinted and qualified in Mission/ruffneckk-suite-next-release.md:185-206."
        },
        {
          "component": "Ground Item Label Limit",
          "disposition": "superseded-by-loader",
          "evidence": "D2RLoader 1.2 provides the equivalent native feature; the RuffnecKk presets were removed from the next Suite scope."
        }
      ],
      "gates": {
        "sourceVerified": {
          "status": "passed",
          "evidence": [
            "The public 1.2.1 distribution was inspected on 2026-09-04."
          ]
        },
        "artifactIntegrity": {
          "status": "passed",
          "evidence": [
            "The three extracted public artifacts were sized and SHA-256 hashed from analysis-cache/d2rloader-1.2.1-release-audit/."
          ]
        },
        "sdkAudit": {
          "status": "passed",
          "evidence": [
            "PluginSDK v3 and v4 pins are documented in the Suite THIRD_PARTY_NOTICES.md and the governed SDK service audit."
          ]
        },
        "contractAudit": {
          "status": "passed",
          "evidence": [
            "Manifest v2, the three plugin exports, service contracts and version-neutral native selection policy were reviewed for the Suite."
          ]
        },
        "staticCompatibility": {
          "status": "passed",
          "evidence": [
            "The affected ISC12 and Vendor providers were checked byte-exact before runtime qualification."
          ]
        },
        "runtimeQualification": {
          "status": "passed",
          "evidence": [
            "Cold start on D2R 3.3.93847 with the public D2RLoader 1.2.1 reached 24/24 on 2026-09-04."
          ]
        },
        "fullStackCoexistence": {
          "status": "passed",
          "evidence": [
            "The qualified run loaded 37 plugins and 17 memory patches with only the two documented pre-existing failures."
          ]
        },
        "multiplayer": {
          "status": "not-run",
          "evidence": [
            "No multiplayer compatibility claim is inherited from the loader baseline."
          ]
        }
      },
      "notes": [
        "The PE file version remains 1.2.1-beta even though this is the inspected public 1.2.1 distribution.",
        "Loader version and channel are diagnostic metadata and never authorize or reject plugin loading."
      ]
    },
    {
      "id": "d2rloader-1.3-local",
      "version": "1.3.0-beta+candidate.4",
      "channel": "beta",
      "stage": "source-verified",
      "observedAt": "2026-09-10",
      "promotedAt": null,
      "supersededAt": null,
      "source": {
        "kind": "local-audit",
        "url": "file:///C:/Users/Vince/Downloads/D2RLoader-1.3.0-beta-candidate.4.zip",
        "verifiedAt": "2026-09-13",
        "evidence": [
          "Vincent supplied D2RLoader-1.3.0-beta-candidate.4.zip as the governed local D2RLoader 1.3 source on 2026-09-13; archive SHA-256 CDF2FD29BB683B0E94B9284A53855BE6111F0CACE8FED7B8761EDA2ACD2B90F3.",
          "plugin-dev/mapsense/mission.md:4025-4069 records local D2RLoader 1.3 negotiation, adaptation and a successful cold start for the MapSense candidate."
        ]
      },
      "artifacts": [
        {
          "name": "D2RLoader.exe",
          "size": 23501672,
          "sha256": "ACC5375875986A0235AD9E039B4FE512FE7C5718C6420DE9C125A8CF1A311EE8",
          "fileVersion": "1.3.0-beta+candidate.4",
          "evidencePath": "analysis-cache/d2rloader-release-intake/d2rloader-1.3-local/candidate.4/D2RLoader.exe"
        },
        {
          "name": "D2RCore.dll",
          "size": 18280792,
          "sha256": "61D1E03DB4196DDEDCB154331566AE9E21E140A235824202FE41CC3011419E8F",
          "fileVersion": "1.3.0-beta+candidate.4",
          "evidencePath": "analysis-cache/d2rloader-release-intake/d2rloader-1.3-local/candidate.4/D2RCore.dll"
        },
        {
          "name": "d2rloader.mpq",
          "size": 10816549,
          "sha256": "D5EBCD3488E3E0DE0CDF3938BD1DB2C6B4953129C9B651C949BDBEA969AF0BC6",
          "fileVersion": null,
          "evidencePath": "analysis-cache/d2rloader-release-intake/d2rloader-1.3-local/candidate.4/d2rloader.mpq"
        }
      ],
      "sdk": {
        "selectionPolicy": "minimum-required-capability",
        "pins": [
          {
            "apiVersion": 4,
            "tag": "v4",
            "commit": "6eb8f8b6192868214706bd6d528c5294f2f551b7",
            "role": "required",
            "repository": "https://github.com/D2RLoader/PluginSDK"
          }
        ]
      },
      "contracts": {
        "reviewed": false,
        "pluginManifestVersion": null,
        "requiredExports": [],
        "runtimeSelectionPolicy": "native-fingerprint-only"
      },
      "impactReview": [
        {
          "component": "RuffnecKk MapSense",
          "disposition": "adapted",
          "evidence": "plugin-dev/mapsense/mission.md:4037-4069 records the common stat adapter and a successful candidate cold start under the local 1.3 baseline; gameplay and visual gates remained open."
        }
      ],
      "gates": {
        "sourceVerified": {
          "status": "passed",
          "evidence": [
            "Vincent identified the governed local target as D2RLoader 1.3 with PluginSDK API v4; plugin-dev/mapsense/mission.md:4025-4069 independently records use of that local baseline."
          ]
        },
        "artifactIntegrity": {
          "status": "passed",
          "evidence": [
            "The supplied 46826746-byte candidate.4 ZIP contains exactly one D2RLoader.exe, D2RCore.dll and d2rloader.mpq at its root; all three were extracted under analysis-cache/d2rloader-release-intake/d2rloader-1.3-local/candidate.4 and captured with exact sizes and SHA-256 identities."
          ]
        },
        "sdkAudit": {
          "status": "passed",
          "evidence": [
            "PluginSDK API v4 is pinned to commit 6eb8f8b6192868214706bd6d528c5294f2f551b7 in the governed Suite release allowlists and is the required local API selected by Vincent."
          ]
        },
        "contractAudit": {
          "status": "blocked",
          "evidence": [
            "The exact candidate.4 artifacts are now retained locally, but their manifest, exports, lifecycle and provider contracts have not yet completed the governed delta audit."
          ]
        },
        "staticCompatibility": {
          "status": "blocked",
          "evidence": [
            "MapSense has targeted 1.3 evidence, but a complete impact review for every active Suite component is not present in the local registry evidence."
          ]
        },
        "runtimeQualification": {
          "status": "blocked",
          "evidence": [
            "plugin-dev/mapsense/mission.md records a candidate cold start, not a complete baseline-wide runtime qualification."
          ]
        },